doi,name,affiliation,publisher,type
10.1200/jco.2014.60.6376,"Rodriguez-Galindo, Carlos","Carlos Rodriguez-Galindo and Paola Friedrich, Dana-Farber/Boston Children's Cancer and Blood Disorders Center and Harvard Medical School, Boston, MA; Patricia Alcasabas, Philippines General Hospital, Manila, Philippines; Federico Antillon, Unidad Nacional de Oncología Pediátrica, and Francisco Marroquín Medical School, Guatemala City, Guatemala; Shripad Banavali, Tata Memorial Hospital, Mumbai, India; Luis Castillo, Hospital Pereira Rossell, Montevideo, Uruguay; Trijn Israels, Vrije Universiteit Medical...",American Society of Clinical Oncology (ASCO),JOUR
10.1115/1.1615619,"Maas, Huub","Instituut voor Fundamentele en Klinische Bewegingswetenschappen, Faculteit Bewegingswetenschappen, Vrije Universiteit, Van der Boechorststraat 9, 1081 BT, Amsterdam, The Netherlands",ASME International,JOUR
10.1093/eurheartj/ehz333,"Lemkes, Jorrit S","Department of Cardiology, Amsterdam Cardiovascular Sciences, Amsterdam UMC, Vrije Universiteit Amsterdam, De Boelelaan 1117, Amsterdam, the Netherlands",Oxford University Press (OUP),JOUR
10.1152/jn.00498.2016,"McCoy, Brónagh","Department of Experimental and Applied Psychology, Vrije Universiteit Amsterdam, Amsterdam, The Netherlands",American Physiological Society,JOUR
10.1084/jem.170.2.499,"Thepen, T","Department of Histology, Vrije Universiteit, Amsterdam, The Netherlands.",Rockefeller University Press,JOUR
10.5281/zenodo.3460310,Petrescu A.M.R.,Vrije Universiteit Amsterdam,Zenodo,DATA
10.5281/zenodo.3662371,Petrescu A.M.R.,Vrije Universiteit Amsterdam,Zenodo,DATA
10.1021/acs.jctc.6b00177,"Vuckovic, Stefan","Department of Theoretical Chemistry and Amsterdam Center for Multiscale Modeling, FEW, Vrije Universiteit, De Boelelaan 1083, 1081HV Amsterdam, The Netherlands",American Chemical Society (ACS),JOUR
10.1021/acs.jctc.5b00387,"Vuckovic, Stefan","Department of TheoreticalChemistry and Amsterdam Center for Multiscale Modeling, FEW, Vrije Universiteit, De Boelelaan 1083, 1081HV Amsterdam, The Netherlands",American Chemical Society (ACS),JOUR
10.1111/j.1438-8677.1992.tb01332.x,"Ernst, W. H. O.","Department of Ecology and Ecotoxicology, Faculty of Biology; Vrije Universiteit; De Boelelaan 1087 1081 HV Amsterdam The Netherlands",Wiley,JOUR
10.1155/2010/324719,"Laine, Marja L.","Department of Oral Microbiology, Academic Center for Dentistry Amsterdam (ACTA), University of Amsterdam and Vrije University, 1081 BT Amsterdam, The Netherlands",Hindawi Limited,JOUR
10.1080/24751839.2017.1295653,"Treur, Jan","Department of Computer Science, Behavioural Informatics Group, Vrije Universiteit Amsterdam, The Netherlands",Informa UK Limited,JOUR
10.1155/2016/1934270,"van Esterik, Fransisca A. S.","Department of Oral Cell Biology, Academic Centre for Dentistry Amsterdam (ACTA), University of Amsterdam and Vrije Universiteit Amsterdam, MOVE Research Institute Amsterdam, Amsterdam, Netherlands; Department of Dental Materials Science, Academic Centre for Dentistry Amsterdam (ACTA), University of Amsterdam and Vrije Universiteit Amsterdam, MOVE Research Institute Amsterdam, Amsterdam, Netherlands",Hindawi Limited,JOUR
10.1002/wps.20661,"Cuijpers, Pim","Department of Clinical, Neuro and Developmental Psychology, Amsterdam Public Health Research InstituteVrije Universiteit Amsterdam Amsterdam The Netherlands",Wiley,JOUR
10.1080/00140130500101346,"Savelsbergh, Geert J. P.","a  Research Institute for Fundamental and Clinical Human Movement Sciences, Vrije Universiteit Amsterdam , Amsterdam,  The Netherlands; b   Institute for Biophysical and Clinical Research into Human Movement , Manchester Metropolitan University , Manchester,  UK",Informa UK Limited,JOUR
10.1146/annurev.genet.33.1.261,"Venema, Jaap","Department of Biochemistry and Molecular Biology, IMBW, BioCentrum Amsterdam, Vrije Universiteit, HV Amsterdam, 1081 The Netherlands;; Institute of Cell and Molecular Biology, University of Edinburgh, King's Buildings, Swann Building, Edinburgh, EH9 3JR, United Kingdom; e-mail:",Annual Reviews,JOUR
10.1002/jor.23797,"Boers, Heleen E.",Laboratory for Myology; Faculty of Behavioural and Movement Sciences; Vrije Universiteit Amsterdam; Amsterdam Movement Sciences; De Boelelaan 1108 1081 HZ Amsterdam The Netherlands,Wiley,JOUR
10.1111/ijmr.12140,"Kranzbühler, Anne-Madeleine",Vrije Universiteit Amsterdam and VODW; De Boelelaan 1105 1081 HV Amsterdam The Netherlands,Wiley,JOUR
10.1002/ange.201701486,"Bickelhaupt, F. Matthias",Department of Theoretical Chemistry und Amsterdam Center for Multiscale Modeling (ACMM); Vrije Universiteit Amsterdam; De Boelelaan 1083 1081 HV Amsterdam Niederlande; Institute of Molecules and Materials (IMM); Radboud University; Heyendaalseweg 135 6525 AJ Nijmegen Niederlande,Wiley,JOUR
10.5281/zenodo.3688391,"Schrammeijer, Bep",Vrije Universiteit Amsterdam,Zenodo,DATA
10.5281/zenodo.3688392,"Schrammeijer, Bep",Vrije Universiteit Amsterdam,Zenodo,DATA
10.5281/zenodo.3674737,"Filyushkina, A.",Vrije Universiteit Amsterdam,Zenodo,RPRT
10.5281/zenodo.3674738,"Filyushkina, A.",Vrije Universiteit Amsterdam,Zenodo,RPRT
10.1111/jcom.12211,"Burgers, Christian",Department of Communication Science; Vrije Universiteit Amsterdam; 1081 HV Amsterdam The Netherlands,Oxford University Press (OUP),JOUR
10.1029/2002jb002073,"Garcia-Castellanos, Daniel",Faculty of Earth Sciences; Vrije Universiteit; Amsterdam Netherlands,American Geophysical Union (AGU),JOUR
10.1080/13523260.2016.1228034,"Wagner, Wolfgang","Department of Political Science and Public Administration, Vrije Universiteit Amsterdam, Amsterdam, The Netherlands",Informa UK Limited,JOUR
10.1146/annurev.polisci.12.041107.102315,"Hooghe, Liesbet","Department of Political Science, University of North Carolina, Chapel Hill, North Carolina 27599; email: ,; Department of Political Science, Vrije Universiteit Amsterdam, the Netherlands",Annual Reviews,JOUR
10.1021/acsenergylett.6b00595,"ten Brinck, Stephanie","Department of TheoreticalChemistry, Faculty of Sciences, Vrije Universiteit Amsterdam, 1081 HV Amsterdam, The Netherlands",American Chemical Society (ACS),JOUR
10.1177/0022022104264126,"van Herk, Hester",Vrije Universiteit Amsterdam,SAGE Publications,JOUR
10.1111/cdoe.12345,"van der Zande, Marieke M.",Department of Oral Implantology and Prosthetic Dentistry; Academic Centre for Dentistry Amsterdam (ACTA); University of Amsterdam and Vrije Universiteit; Amsterdam The Netherlands; Department of Social Dentistry and Behavioural Sciences; Academic Centre for Dentistry Amsterdam (ACTA); University of Amsterdam and Vrije Universiteit; Amsterdam The Netherlands,Wiley,JOUR
10.1021/acs.jpcc.6b07247,"Polak, Leo","Department of Physics andAstronomy, Vrije Universiteit Amsterdam, 1081 HV Amsterdam, The Netherlands",American Chemical Society (ACS),JOUR
10.1111/radm.12180,"Galán-Muros, Victoria","Faculty of Social Sciences; Vrije Universiteit Amsterdam; De Boelelaan 1105, 1081HV Amsterdam The Netherlands; Science to Business Marketing Research Centre; Münster University of Applied Sciences; Corrensstraße 25, 48149 Münster Germany",Wiley,JOUR
10.1027/0227-5910/a000316,"de Beurs, Derek","Netherlands Institute for Health Services Research (Nivel), Utrecht, The Netherlands; Department of Clinical Psychology, Vrije Universiteit Amsterdam, The Netherlands",Hogrefe Publishing Group,JOUR
10.1042/bst20120115,"Millo, Diego","Vrije Universiteit Amsterdam, Biomolecular Spectroscopy/LaserLaB Amsterdam, De Boelelaan 1083, NL-1081 HV Amsterdam, The Netherlands",Portland Press Ltd.,JOUR
10.1093/jpo/joy015,"Heusinkveld, Stefan","School of Business and Economics, Vrije Universiteit Amsterdam, The Netherlands",Oxford University Press (OUP),JOUR
10.18140/flx/1440182,"Dolman, Han",Vrije Universiteit Amsterdam,FluxNet; Vrije Universiteit Amsterdam,DATA
10.1177/1464884916688290,"Kormelink, Tim Groot","Vrije Universiteit Amsterdam, The Netherlands",SAGE Publications,JOUR
10.1111/idh.12316,"Hennequin-Hoenderdos, NL",Department of Periodontology; Academic Centre for Dentistry Amsterdam (ACTA); University of Amsterdam and Vrije Universiteit Amsterdam; Amsterdam The Netherlands,Wiley,JOUR
10.1080/07474930600712848,"Jungbacker, Borus","a Department of Econometrics , Vrije Universiteit Amsterdam, Tinbergen Institute Amsterdam , Netherlands",Informa UK Limited,JOUR
10.2304/eerj.2007.6.1.13,"Lunenberg, Mieke","Vrije University, Amsterdam, Netherlands",SAGE Publications,JOUR
10.1111/j.1438-8677.1986.tb00485.x,"Rozema, J.","Vakgroep Oecologie en Oecotoxicologie, Biologisch Laboratorium, Vrije Universiteit; De Boelelaan 1087 1081 HV Amsterdam",Wiley,JOUR
10.1518/0018720024494775,"Theeuwes, Jan","Vrije Universiteit, Amsterdam, Netherlands",SAGE Publications,JOUR
10.1177/1087054716658124,"Veenman, Betty","Vrije Universiteit Amsterdam, The Netherlands",SAGE Publications,JOUR
10.1111/jcpe.12711,"Sun, Xiaoyu","Department of Periodontology School and Hospital of Stomatology Wenzhou Medical University Wenzhou China; Institute of Stomatology School and Hospital of Stomatology Wenzhou Medical University Wenzhou China; Department of Oral Implantology and Prosthetic Dentistry Academic Centre for Dentistry Amsterdam (ACTA) University of Amsterdam and Vrije Universiteit Amsterdam, Amsterdam Movement Sciences Amsterdam The Netherlands",Wiley,JOUR
10.1002/jcc.24383,"Zaccaria, Francesco",Department of Theoretical Chemistry and Amsterdam Center for Multiscale Modeling; Vrije Universiteit Amsterdam; De Boelelaan 1083 Amsterdam 1081 HV the Netherlands,Wiley,JOUR
10.5281/zenodo.3582927,"Otten, René",Vrije Universiteit Amsterdam,Zenodo,RPRT
10.5281/zenodo.3582928,"Otten, René",Vrije Universiteit Amsterdam,Zenodo,RPRT
10.1002/chir.22330,"Nicu, Valentin Paul",Theoretical Chemistry; Vrije Universiteit Amsterdam; Amsterdam The Netherlands,Wiley,JOUR
10.1096/fj.01-0206fje,"Elmore, Steven P.",Laboratory for PhysiologyVrije UniversityVan der Boechorststraat 71081 BTAmsterdamThe Netherlands,Wiley,JOUR
10.1084/jem.172.4.1025,"Huitinga, I","Department of Cell Biology, Medical Faculty, Vrije Universiteit, Amsterdam, The Netherlands.",Rockefeller University Press,JOUR
10.2466/pms.102.2.302-308,"van Rossum, Jacques H. A.","Human Movement Sciences, Vrije Universiteit, Dance Department, The Theatre School, Amsterdam",SAGE Publications,JOUR
10.1161/01.atv.20.5.1396,"Giltay, E. J.","From the Institute of Endocrinology, Reproduction and Metabolism (E.J.G., L.J.G.G.), the Department of Internal Medicine (C.D.A.S.), and the Institute for Cardiovascular Research (C.D.A.S.), University Hospital Vrije Universiteit, Amsterdam, and the Gaubius Laboratory (J.J.E., T.K.), The Netherlands Organization for Applied Research, Leiden, the Netherlands.",Ovid Technologies (Wolters Kluwer Health),JOUR
10.1021/acs.analchem.7b00211,"Gahoual, Rabah","Division of BioAnalytical Chemistry, Vrije Universiteit Amsterdam, 1081 HV Amsterdam, The Netherlands",American Chemical Society (ACS),JOUR
10.1177/0093650205285366,"de Vries, Reinout E.","Vrije Universiteit, Amsterdam, Netherlands,",SAGE Publications,JOUR
10.1021/acs.jcim.7b00222,"van Dijk, Marc","AIMMSDivision of Molecular Toxicology, Department of Chemistry and PharmaceuticalSciences, Vrije Universiteit Amsterdam, De Boelelaan 1108, 1081 HZ Amsterdam, The Netherlands",American Chemical Society (ACS),JOUR
10.1080/00140130310001617967,"Visser, Bart","a   Institute for Fundamental and Clinical Human Movement Sciences, Faculty of Human Movement Sciences , Vrije Universiteit Amsterdam ,  The Netherlands; b  Research Centre Body@Work, TNO Work and Employment , Hoofddorp,  The Netherlands",Informa UK Limited,JOUR
10.1042/bj20042099,"den HERTOG, Alice L.","Department of Oral Biochemistry, Academic Centre for Dentistry Amsterdam (ACTA), Vrije Universiteit and Universiteit van Amsterdam, Van der Boechorststraat 7, 1081 BT, Amsterdam, The Netherlands",Portland Press Ltd.,JOUR
10.1177/1012690209356989,"van Hilvoorde, Ivo","Vrije Universiteit Amsterdam and WJH Mulier Institute, The Netherlands,",SAGE Publications,JOUR
10.1111/1751-7915.12368,"van den Nieuwboer, Maurits",Athena Institute; Vrije Universiteit; Amsterdam The Netherlands,Wiley,JOUR
10.1002/wps.20630,"Boschloo, Lynn","Department of Clinical, Neuro and Developmental Psychology, Amsterdam Public Health Research InstituteVrije Universiteit AmsterdamAmsterdamThe Netherlands; Department of Psychiatry and Interdisciplinary Center Psychopathology and Emotion Regulation (ICPE)University of Groningen, University Medical Center GroningenGroningenThe Netherlands",Wiley,JOUR
10.1068/a39369,"de Vries, Jacob J","Department of Spatial Economics, Vrije Universiteit, De Boelelaan 1105, NL-1081HV Amsterdam, The Netherlands",SAGE Publications,JOUR
10.1111/spc3.12255,"Wu, Junhui",Vrije Universiteit Amsterdam,Wiley,JOUR
10.1111/jcpe.12435,"Oliveira, Sara Cioccari",Department of Periodontology; Academic Centre for Dentistry Amsterdam (ACTA); University of Amsterdam and Vrije University Amsterdam; Amsterdam The Netherlands; Department of Social and Preventive Dentistry; Faculty of Dentistry; Federal University of Rio Grande do Sul; Porto Alegre Brazil,Wiley,JOUR
10.2991/jnmp.2002.9.s1.18,"Wang, Jing Ping","a  Division of Mathematics &amp; Computer Science, Faculty of Sciences , Vrije Universiteit,  Amsterdam ,  The Netherlands  E-mail:",Informa UK Limited,JOUR
10.1080/02701367.2017.1413230,"Limpens, Vera",Vrije Universiteit Amsterdam,Informa UK Limited,JOUR
10.3945/ajcn.2009.28113,"Lips, Paul",From the Department of Endocrinology Vrije Universiteit Medisch Centrum Amsterdam Netherlands (PL); the Department of Osteoporosis Clinical Research University of Wisconsin Madison WI (NB); Klinik der Furstenhof Bad Pyrmont Germany (MP); the Osteoporosis Research Center Creighton University Omaha NE (RR); Merck & Co Inc Rahway NJ (SS DAC JCDAP);Merck & Co Inc North Wales PA (ER).,Oxford University Press (OUP),JOUR
10.1177/0170840616655489,"van Marrewijk, Alfons","Vrije Universiteit Amsterdam, The Netherlands",SAGE Publications,JOUR
10.1029/2002jb002190,"Smit, J. H. W.","Netherlands Centre for Integrated Solid Earth Science, Faculty of Earth and Life Sciences; Vrije Universiteit; Amsterdam Netherlands",American Geophysical Union (AGU),JOUR
10.1105/tpc.105.034041,"Quattrocchio, Francesca","Institute for Molecular and Cellular Biology, Vrije Universiteit, 1081 HV Amsterdam, The Netherlands",American Society of Plant Biologists (ASPB),JOUR
10.1509/jmkg.75.5.34,"Noordhoff, Corine S.",Vrije Universiteit Amsterdam,SAGE Publications,JOUR
10.1177/2053951716662054,"Mulder, Femke","Vrije Universiteit, The Netherlands",SAGE Publications,JOUR
10.1111/nph.14766,"Cornelissen, Johannes H. C.",Systems Ecology; Department of Ecological Science; Faculty of Science; Vrije Universiteit Amsterdam; De Boelelaan 1085 1081 HV Amsterdam the Netherlands,Wiley,JOUR
10.1039/c7cp02123b,"Baerends, E. J.",Section Theoretical Chemistry; Vrije Universiteit; Amsterdam; The Netherlands,Royal Society of Chemistry (RSC),JOUR
10.1093/ajcn/87.1.150,"Houston, Denise K","From the Sticht Center on Aging, Wake Forest University School of Medicine, Winston-Salem, NC (DKH, BJN, JD, and SBK); the National Institute on Aging, Bethesda, MD (TBH); the University of Tennessee, Memphis, TN (FAT); the University of Pittsburgh, Pittsburgh, PA (ABN); the University of Georgia, Athens, GA (JSL); the University of Maryland, College Park, MD (NRS); and Vrije University, Amsterda",Oxford University Press (OUP),JOUR
10.1080/092970490911351,"Stins, John F.","a   Vrije Universiteit  , Amsterdam,  The Netherlands",Informa UK Limited,JOUR
10.1080/02699052.2018.1531301,"Milders, Maarten","Department of Clinical Neuropsychology, Vrije Universiteit Amsterdam, Amsterdam, Netherlands",Informa UK Limited,JOUR
10.1039/c5cp01806d,"Michael Gruber, J.",Department of Biophysics; Faculty of Sciences; Vrije Universiteit; 1081HV Amsterdam; The Netherlands,Royal Society of Chemistry (RSC),JOUR
10.1093/ejcts/ezx438,"Nederend, Ineke","Department of Biological Psychology, Faculty of Behavioral and Movement Sciences, Amsterdam Public Health Research Institute, Vrije Universiteit Amsterdam, Amsterdam, Netherlands; Department of Pediatric Cardiology, LUMC University Medical Center, Leiden, Netherlands",Oxford University Press (OUP),JOUR
10.1152/jn.00898.2002,"Meems, Ryanne","Department of Molecular and Cellular Neurobiology, Research Institute Neuroscience Vrije Universiteit, Faculty of Earth and Life Sciences, 1081 HV Amsterdam, The Netherlands; and",American Physiological Society,JOUR
10.5465/amj.2016.0687,"Deken, Fleur",Vrije Universiteit Amsterdam,Academy of Management,JOUR
10.1111/1467-8551.12214,"Gutermann, Daniela",Jacobs University Bremen (and Vrije Universiteit Amsterdam); Campus Ring 1 28759 Bremen Germany,Wiley,JOUR
10.1111/jopy.12357,"Schlinkert, Caroline",Vrije Universiteit Amsterdam; University of Trier,Wiley,JOUR
10.1105/tpc.108.060871,"Souer, Erik","Institute for Molecular Cell Biology, Graduate School of Experimental Plant Sciences, Vrije Universiteit, 1081HV Amsterdam, The Netherlands",American Society of Plant Biologists (ASPB),JOUR
10.1177/0013916517738563,"van den Berg, Magdalena M.","Vrije Universiteit Amsterdam, The Netherlands",SAGE Publications,JOUR
10.1063/1.4966918,"Rüger, Robert","Scientific Computing and Modelling NV, De Boelelaan 1083, 1081 HV Amsterdam, The Netherlands; Department of Theoretical Chemistry, Vrije Universiteit Amsterdam, De Boelelaan 1083, 1081 HV Amsterdam, The Netherlands; Wilhelm-Ostwald-Institut für Physikalische und Theoretische Chemie, Linnéstr. 2, 04103 Leipzig, Germany",AIP Publishing,JOUR
10.1021/ct4004959,"Wahiduzzaman, Mohammad","School ofEngineering and Science, Jacobs University Bremen, Campus Ring 1, 28759 Bremen,Germany; Scientific Computing&amp; ModellingNV, Theoretical Chemistry, Vrije Universiteit, De Boelelaan 1083, 1081 HV Amsterdam, The Netherlands",American Chemical Society (ACS),JOUR
10.1177/1471301206067115,"Eggermont, Laura H.P.","Vrije Universiteit, The Netherlands",SAGE Publications,JOUR
10.1080/1350293x.2015.1120520,"Worthington, Maulfry","Vrije University, Amsterdam, The Netherlands",Informa UK Limited,JOUR
10.1080/1369183x.2016.1276825,"Last, Tamara","Migration Law, Vrije Universiteit Amsterdam, Amsterdam, The Netherlands",Informa UK Limited,JOUR
10.1080/02724980042000039,"Michaels, Claire F.","Vrije Universiteit, Amsterdam, The Netherlands",SAGE Publications,JOUR
10.1002/da.22461,"Cuijpers, Pim","Department of Clinical, Neuro and Developmental Psychology; Vrije Universiteit Amsterdam; Amsterdam The Netherlands; EMGO Institute for Health and Care Research; Amsterdam The Netherlands",Wiley,JOUR
10.1002/wps.20346,"Cuijpers, Pim","Department of Clinical, Neuro and Developmental Psychology; Vrije Universiteit Amsterdam; Amsterdam The Netherlands; EMGO Institute for Health and Care Research; Amsterdam The Netherlands",Wiley,JOUR
10.5281/zenodo.3677736,"Scussolini, Paolo","Institute for Environmental Studies, Vrije Universiteit Amsterdam",Zenodo,DATA
10.5281/zenodo.3677737,"Scussolini, Paolo","Institute for Environmental Studies, Vrije Universiteit Amsterdam",Zenodo,DATA
10.1080/10408363.2019.1670613,"Wesenhagen, Kirsten E. J.","Alzheimer Center Amsterdam, Department of Neurology, Amsterdam Neuroscience, Vrije Universiteit Amsterdam, Amsterdam UMC, Amsterdam, The Netherlands;",Informa UK Limited,JOUR
10.1039/c7nr09224e,"Vorselen, Daan",Department of Physics and Astronomy and LaserLab; Vrije Universiteit; Amsterdam; The Netherlands; Department of Oral Function and Restorative Dentistry,Royal Society of Chemistry (RSC),JOUR
10.1021/acs.inorgchem.7b02994,"Brands, Maria B.","Department of Theoretical Chemistry and Amsterdam Center for Multiscale Modeling, Vrije Universiteit Amsterdam, De Boelelaan 1083, 1081 HV Amsterdam, The Netherlands",American Chemical Society (ACS),JOUR
10.1021/jacs.7b11422,"Hauwert, Niels J.","Division of Medicinal Chemistry, Amsterdam Institute for Molecules, Medicines and Systems, Faculty of Science, Vrije Universiteit Amsterdam, De Boelelaan 1108, 1081 HZ Amsterdam, The Netherlands",American Chemical Society (ACS),JOUR
10.1002/nml.21306,"Wassenaar, Mattheus",School of Business and Economics; Vrije Universiteit Amsterdam; Amsterdam The Netherlands,Wiley,JOUR
10.1021/acs.nanolett.7b04842,"King, Graeme A.","Department of Physics and Astronomy, LaserLaB Amsterdam, Vrije Universiteit Amsterdam, De Boelelaan 1081, 1081 HV Amsterdam, The Netherlands",American Chemical Society (ACS),JOUR
10.1002/chem.201805215,"Svatunek, Dennis","Institute of Applied Synthetic ChemistryTU Wien (Vienna University of Technology) Getreidemarkt 9/163 1060 Vienna Austria; Department of Theoretical Chemistry and Amsterdam Center for, Multiscale Modeling (ACMM)Vrije Universiteit Amsterdam De Boelelaan 1083 1081 HV Amsterdam The Netherlands",Wiley,JOUR
10.1002/chem.201706075,"Hamlin, Trevor A.",Department of Theoretical Chemistry; Amsterdam Center for Multiscale Modeling (ACMM); Vrije Universiteit Amsterdam; De Boelelaan 1083 1081 HV Amsterdam The Netherlands,Wiley,JOUR
10.1021/acs.jpclett.8b02780,"Hontani, Yusaku","Department of Physics and Astronomy, Vrije Universiteit, Amsterdam 1081 HV, The Netherlands",American Chemical Society (ACS),JOUR
10.1002/jrs.5494,"Moester, Miriam J.B.","Institute for Lasers, Life and Biophotonics, Department of Physics and AstronomyVrije Universiteit Amsterdam Amsterdam The Netherlands",Wiley,JOUR
10.1111/1460-6984.12376,"van Knijff, Eline C.",Language and Hearing Center Amsterdam; Vrije Universiteit Amsterdam; the Netherlands,Wiley,JOUR
10.1080/21567689.2018.1436138,"Kootstra, Jochem Gerardus",Vrije Universiteit Amsterdam,Informa UK Limited,JOUR
10.15252/emmm.201809323,"Mouliere, Florent","Cancer Research UK Cambridge Institute University of Cambridge Cambridge UK; Cancer Research UK Major Centre – Cambridge Cancer Research UK Cambridge Institute Cambridge UK; Department of Pathology Cancer Center Amsterdam Amsterdam UMC, Vrije Universiteit Amsterdam Amsterdam The Netherlands",EMBO,JOUR
10.1080/20022727.2018.1551596,"Cieplik, Fabian","Department of Conservative Dentistry and Periodontology, University Medical Center Regensburg, Regensburg, Germany; Department of Preventive Dentistry, Academic Centre for Dentistry Amsterdam (ACTA), University of Amsterdam and Vrije Universiteit Amsterdam, Amsterdam, The Netherlands",Informa UK Limited,JOUR
10.1002/cre2.100,"Tastepe, Ceylin S.","Department of Oral Implantology and Prosthetic Dentistry, Academic Centre for Dentistry Amsterdam (ACTA); University of Amsterdam and Vrije Universiteit Amsterdam",Wiley,JOUR
10.1111/jnc.14603,"Li, K. W.",Department of Molecular and Cellular Neurobiology Center for Neurogenomics and Cognitive Research Amsterdam Neuroscience Vrije Universiteit Amsterdam The Netherlands,Wiley,JOUR
10.1080/09638288.2018.1503729,"Ebuenyi, Ikenna D.","Athena Institute, Amsterdam Public Health Research Institute, Vrije Universiteit Amsterdam, Amsterdam, The Netherlands",Informa UK Limited,JOUR
10.1111/jan.13880,"Schutijser, Bernadette C. F. M.",Department of Public and Occupational Health; Amsterdam Public Health Research Institute; Amsterdam UMC; Vrije Universiteit Amsterdam; Amsterdam The Netherlands,Wiley,JOUR
10.1080/03086534.2018.1539725,"Groten, Miel","Vrije Universiteit Amsterdam, Amsterdam, the Netherlands",Informa UK Limited,JOUR
10.1111/sode.12348,"Pronk, Jeroen",Clinical Developmental Psychology Vrije Universiteit Amsterdam Amsterdam the Netherlands,Wiley,JOUR
10.1111/aos.13956,"Nispen, Ruth","Ophthalmology, Amsterdam Public Health research institute Amsterdam UMC Vrije Universiteit Amsterdam Amsterdam the Netherlands",Wiley,JOUR
10.1021/acs.analchem.8b00015,"Voeten, Robert L. C.","Division of BioAnalytical Chemistry, Department of Chemistry and Pharmaceutical Sciences, Vrije Universiteit Amsterdam, de Boelelaan 1085, 1081 HV Amsterdam, The Netherlands; TI-COAST, Science Park 904, 1098 XH Amsterdam, The Netherlands",American Chemical Society (ACS),JOUR
10.1002/ijc.31967,"Ramayanti, Octavia","Amsterdam UMC, Vrije Universiteit Amsterdam, Department of PathologyCancer Center Amsterdam Amsterdam The Netherlands",Wiley,JOUR
10.1111/gcb.14307,"Prestele, Reinhard",Environmental Geography Group; Institute for Environmental Studies; Vrije Universiteit Amsterdam; Amsterdam The Netherlands,Wiley,JOUR
10.1002/jssc.201800204,"Prior, Amir","Division of BioAnalytical Chemistry, Amsterdam Institute for Molecules, Medicines and Systems; Vrije Universiteit Amsterdam; Amsterdam The Netherlands",Wiley,JOUR
10.1002/chem.201805011,"Zaccaria, Francesco",Department of Theoretical Chemistry and; Amsterdam Center for Multiscale Modeling; Vrije Universiteit Amsterdam; De Boelelaan 1083 1081 HV Amsterdam The Netherlands,Wiley,JOUR
10.1111/bjso.12234,"Alvarez, Katherina",Vrije Universiteit; Amsterdam The Netherlands,Wiley,JOUR
10.1021/acs.analchem.8b00382,"Gargano, Andrea F.G.","Centre for Analytical Science Amsterdam, Science Park 904, 1098 XH Amsterdam, The Netherlands; Amsterdam Institute for Molecules, Medicines and Systems, Vrije Universiteit Amsterdam, de Boelelaan 1083, 1081 HV Amsterdam, The Netherlands; Van ’t Hoff Institute for Molecular Sciences, Science Park 904, 1098 XH Amsterdam, Netherlands",American Chemical Society (ACS),JOUR
10.1080/16506073.2017.1420098,"Cuijpers, Pim","Department of Clinical Psychology, Amsterdam Public Health Research Institute, Vrije Universiteit Amsterdam, Amsterdam 1081 BT, The Netherlands",Informa UK Limited,JOUR
