doi,name,affiliation,publisher,type
10.1111/joop.12261,"Breevaart, Kimberley",Department of Experimental and Applied Psychology Group Social and Organizational Psychology VU Amsterdam The Netherlands,Wiley,JOUR
10.1002/bjs.11117,"Abis, G. S. A.","Department of Surgery, VU University Medical Centre, Amsterdam, the Netherlands",Wiley,JOUR
10.1002/jmri.26609,"Voskuilen, Luuk","Department of Head and Neck Oncology and SurgeryNetherlands Cancer Institute, Antoni van Leeuwenhoek Hospital Amsterdam Netherlands; Department of Radiology and Nuclear MedicineAmsterdam UMC, University of Amsterdam Amsterdam Netherlands; Department of Oral and Maxillofacial Surgery, Academic Centre for Dentistry Amsterdam and Amsterdam UMCUniversity of Amsterdam and VU University Amsterdam Amsterdam Netherlands",Wiley,JOUR
10.1177/1403494819852787,"Sewdas, Ranu","Department of Public and Occupational Health, Amsterdam Public Health Research Institute, Amsterdam UMC, VU University Amsterdam, Amsterdam, The Netherlands",SAGE Publications,JOUR
10.1002/jbm.b.34501,"Bastidas‐Coral, Angela P.","Department of Oral Cell Biology, Academic Centre for Dentistry Amsterdam (ACTA)University of Amsterdam and Vrije Universiteit Amsterdam, Amsterdam Movement Sciences Amsterdam The Netherlands",Wiley,JOUR
10.1002/ijc.32629,"Jongeneel, Gabrielle","Department of Epidemiology and BiostatisticsAmsterdam UMC, VU University Amsterdam The Netherlands",Wiley,JOUR
10.1111/odi.13031,"Hendra, Faqi Nurdiansyah","Department of Oral and Maxillofacial Surgery/Pathology Amsterdam UMC and Academic Centre for Dentistry Amsterdam (ACTA), Vrije Universiteit Amsterdam, Cancer Center Amsterdam Amsterdam The Netherlands; Department of Anatomy, Faculty of Medicine Hasanuddin University Makassar Indonesia",Wiley,JOUR
10.1002/ar.24057,"Catania, Kenneth C.","Vanderbilt UniversityDepartment of Biological Sciences VU Station B, Box 35‐1634, Nashville Tennessee",Wiley,JOUR
10.1177/1476750319844577,"Duijs, Saskia E","Department of Medical Humanities, VU University Medical Centre, Amsterdam Public Health Institute, Amsterdam",SAGE Publications,JOUR
10.1111/jppi.12275,"Zaagsma, Miriam","Philadelphia Care Foundation; Amersfoort the Netherlands; Amsterdam UMC; VU University, Medical Humanities, Amsterdam Public Health research institute; Amsterdam the Netherlands",Wiley,JOUR
10.1111/jppi.12298,"Reinders, Johannes","Professor Emeritus of Ethics, Faculty of Religion and TheologyVU University Amsterdam Amsterdam The Netherlands",Wiley,JOUR
10.1002/advs.201900163,"Zhang, Zhiqing",LaserLab AmsterdamDepartment of Physics and AstronomyFaculty of SciencesVrije Universiteit Amsterdam De Boelelaan 1081 1081 HV Amsterdam The Netherlands; Department of Radiology and Nuclear MedicineAmsterdam Universities Medical Center/VU University Medical Center De Boelelaan 1118 1081 HZ Amsterdam The Netherlands; Amsterdam NeuroscienceVrije Universiteit Amsterdam De Boelelaan 1085 1081 HV Amsterdam The Netherlands,Wiley,JOUR
10.1080/10428194.2019.1594215,"Cremers, Eline M.P.","Department of Hematology, VU University Medical Centre, Amsterdam, The Netherlands;",Informa UK Limited,JOUR
10.1080/13603116.2019.1707305,"MacDonald, Fiona","Institute for Sustainable Industries and Liveable Cities, VU Research, Victoria University, Melbourne, Australia",Informa UK Limited,JOUR
10.1080/17439760.2019.1579352,"Van Doesum, Niels J.","Department of Social and Organizational Psychology, Leiden University, Leiden, Netherlands; Department of Experimental and Applied Psychology, VU Amsterdam, Amsterdam, Netherlands",Informa UK Limited,JOUR
10.1080/0142159x.2019.1692130,"Mak-van der Vossen, Marianne","Department of Research in Education, Faculty of Medicine VU University Amsterdam, Amsterdam UMC, Amsterdam, The Netherlands;",Informa UK Limited,JOUR
10.1093/jeg/lbz003,"Levkovich, Or","Department of Spatial Economics, VU University, De Boelelaan 1105, HV Amsterdam, The Netherlands",Oxford University Press (OUP),JOUR
10.1063/1.5103220,"Gritsenko, Oleg V.","Institute of Physics, Lodz University of Technology, PL-90-924 Lodz, Poland; Section Theoretical Chemistry, VU University, NL-1081 HV Amsterdam, The Netherlands",AIP Publishing,JOUR
10.1021/acs.jmedchem.9b00447,"Bosma, Reggie","Amsterdam Institute for Molecules, Medicines and Systems, Division of Medicinal Chemistry, Faculty of Science, VU University Amsterdam, De Boelelaan 1083, 1081 HV Amsterdam, The Netherlands",American Chemical Society (ACS),JOUR
10.1111/hsc.12793,"Stoop, Annerieke","Centre for Nutrition; Prevention and
Health Services; National Institute for Public Health and the Environment; Bilthoven the Netherlands; Amsterdam Public Health Research Institute, Department of General Practice and Elderly Care Medicine; Amsterdam UMC - VU University Amsterdam; Amsterdam the Netherlands; Scientific Center for Transformation in Care and Welfare (Tranzo); University of Tilburg; Tilburg the Netherlands",Wiley,JOUR
10.1002/jbio.201800297,"van Huizen, Laura M.G.","Department of PhysicsLaserLab, Faculty of Science, VU Amsterdam Amsterdam The Netherlands",Wiley,JOUR
10.1080/1081602x.2019.1633678,"de Hart, Betty","Law Department, VU University Amsterdam, Amsterdam, Netherlands",Informa UK Limited,JOUR
10.1093/hropen/hoz001,"van der Houwen, L E E","Amsterdam UMC, Vrije Universiteit Amsterdam, Endometriosis Centre VUmc, Department of Reproductive Medicine, De Boelelaan 1117, Amsterdam, the Netherlands",Oxford University Press (OUP),JOUR
10.1242/jcs.234674,"Pons-Vizcarra, Maria","Department of Functional Genomics, Center for Neurogenomics and Cognitive Research, Neuroscience Campus Amsterdam, Vrije Universiteit Amsterdam, de Boelelaan 1085, Amsterdam 1081 HV, The Netherlands",The Company of Biologists,JOUR
10.1177/0891988720901783,"Oudega, Mardien Leoniek","GGZ inGeest Specialized Mental Health Care, Amsterdam, the Netherlands; Psychiatry, Amsterdam Neuroscience, Amsterdam UMC, Vrije Universiteit, Amsterdam, the Netherlands; Psychiatry, Amsterdam Public Health Research Institute, Amsterdam UMC, Vrije Universiteit, Amsterdam, the Netherlands",SAGE Publications,JOUR
10.1177/1757177419846286,"Kupfer, Tom R","School of Psychology, University of Surrey, Guildford, UK; Department of Social and Organizational Psychology, VU University, Amsterdam, The Netherlands",SAGE Publications,JOUR
10.1111/aji.13091,"Ess, Eleanne F.","Department of Medical Microbiology &amp; Infection Control, Laboratory of Immunogenetics, Amsterdam UMCVU University Medical Centre Amsterdam The Netherlands",Wiley,JOUR
10.1177/1708538119835402,"Minc, Samantha D","WVU Heart and Vascular Institute, Morgantown, WV, USA",SAGE Publications,JOUR
10.1111/jre.12642,"Rademacher, Steven W. H.",Department of Periodontology; Academic Centre for Dentistry Amsterdam (ACTA); University of Amsterdam and VU University; Amsterdam The Netherlands,Wiley,JOUR
10.1177/2158244019853904,"Maassen, Eva F.","VU University Amsterdam, Amsterdam, The Netherlands; Altrecht Institute for Mental Health Care, Utrecht, The Netherlands",SAGE Publications,JOUR
10.1002/brb3.1208,"Jonker, Frank","Vesalius, Centre for Neuropsychiatry GGZ Altrecht Woerden The Netherlands; Faculty of Behavioral and Movement Sciences, Section Clinical Neuropsychology VU Universiteit Amsterdam Amsterdam The Netherlands",Wiley,JOUR
10.1002/bjs.11102,"Negenborn, V. L.","Department of Plastic, Reconstructive and Hand SurgeryVU University Medical Centre Amsterdam the Netherlands; Amsterdam Public Health Research Institute Amsterdam the Netherlands",Wiley,JOUR
10.1080/0142159x.2018.1554894,"Kusurkar, Rashmi A","Amsterdam UMC, VUmc School of Medical Sciences, Amsterdam, the Netherlands;; Faculty of Psychology and Education, LEARN! Research Institute for Learning And Education, VU University Amsterdam, Amsterdam, the Netherlands",Informa UK Limited,JOUR
10.1177/0018726719893450,"Schakel, Jan Kees","VU University Amsterdam, the Netherlands,",SAGE Publications,JOUR
10.1075/pbns.302.03mac,"Mackenzie, J. Lachlan",VU Amsterdam (Netherlands),John Benjamins Publishing Company,CHAP
10.1287/trsc.2018.0852,"Dabia, Said","School of Business and Economics, VU University Amsterdam, 1081 HV Amsterdam, Netherlands;; Eyefreight B.V., 3981 AJ Bunnik, Netherlands;",Institute for Operations Research and the Management Sciences (INFORMS),JOUR
10.1039/c4gc00013g,"Cioc, Răzvan C.","Department of Chemistry & Pharmaceutical Sciences and Amsterdam Institute for Molecules; Medicines and Systems (AIMMS); VU University Amsterdam; 1081 HV Amsterdam, The Netherlands",Royal Society of Chemistry (RSC),JOUR
10.1177/1471301206069929,"Dröes, Rose-Marie","VU University Medical Centre, Amsterdam,The Netherlands",SAGE Publications,JOUR
10.1111/ger.12155,"Bots-VantSpijker, Pieternella C.",Flemish-Netherlands Geriatric Oral Research Group; BENECOMO; Ghent Belgium; Department of Social Dentistry and Behavioural Sciences; Academic Centre for Dentistry Amsterdam (ACTA); University of Amsterdam and VU University; Amsterdam The Netherlands,Wiley,JOUR
10.1161/strokeaha.109.572065,"Nijland, Rinske H.M.","From Department of Rehabilitation Medicine (R.H.M.N., E.E.H.v.W., G.K.), VU University Medical Centre, Amsterdam, the Netherlands; Department of Rehabilitation Medicine and Physical Therapy (B.C.H.v.d.W.), Erasmus MC University Hospital, Rotterdam, the Netherlands.",Ovid Technologies (Wolters Kluwer Health),JOUR
10.1111/j.1468-036x.2013.12012.x,"Kräussl, Roman",VU University Amsterdam AND Goizueta Business School; Emory University,Wiley,JOUR
10.3852/12-390,"Campbell, Matthew A.","Vanderbilt University, Department of Biological Sciences, VU Station B 351364, Nashville, Tennessee 37235, and University of Hawaii at Mânoa, Botany Department, 3190 Maile Way, Room 101, Honolulu, Hawaii 96822",Informa UK Limited,JOUR
10.1111/adb.12391,"Treur, Jorien L.",Department of Biological Psychology; VU University Amsterdam; Amsterdam The Netherlands; EMGO+ Institute for Health and Care Research; VU University Medical Center; Amsterdam The Netherlands,Wiley,JOUR
10.1177/0022034516681768,"Bronckers, A.L.J.J.","Department of Oral Cell Biology, Academic Centre for Dentistry Amsterdam (ACTA), University of Amsterdam and VU University Amsterdam, MOVE Research Institute, Amsterdam, Netherlands",SAGE Publications,JOUR
10.1111/bph.13732,"Boa, B C S","Department of Physiology; VU University Medical Centre; Amsterdam The Netherlands; Laboratory for Clinical and Experimental Research on Vascular Biology (BioVasc), Biomedical Center; State University of Rio de Janeiro; Rio de Janeiro Brazil",Wiley,JOUR
10.1002/2017jd027346,"Gevaert, A. I.",Department of Earth and Life SciencesVU Amsterdam Amsterdam Netherlands,American Geophysical Union (AGU),JOUR
10.1111/jcpe.12578,"Bizzarro, Sergio",Department of Periodontology; Academic Centre for Dentistry of Amsterdam (ACTA); University of Amsterdam and VU University of Amsterdam; Amsterdam The Netherlands,Wiley,JOUR
10.1111/j.1467-9280.2009.02400.x,"Foroni, Francesco","Department of Social Psychology, VU University Amsterdam",SAGE Publications,JOUR
10.1177/0022034512440450,"Elfrink, M.E.C.","Department of Cariology, Endodontology and Pedodontology, Academic Centre for Dentistry Amsterdam (ACTA), University of Amsterdam and VU University Amsterdam, Gustav Mahlerlaan 3004, 1081 LA Amsterdam, The Netherlands; The Generation R Study Group Erasmus Medical Centre - Sophia Children’s Hospital, Rotterdam, The Netherlands",SAGE Publications,JOUR
10.1002/adfm.201504020,"Friebe, Vincent M.",Department of Physics and Astronomy; LaserLaB Amsterdam; VU University Amsterdam; De Boelelaan 1081 1081 HV Amsterdam The Netherlands,Wiley,JOUR
10.1177/0149206312471391,"Drees, Johannes M.",VU University Amsterdam,SAGE Publications,JOUR
10.1115/1.4033428,"Hu, Zhen","Department of Civil and Environmental Engineering, Vanderbilt University, 279 Jacobs Hall, VU Mailbox: PMB 351831, Nashville, TN 37235 e-mail: ",ASME International,JOUR
10.1027/1618-3169/a000122,"Regenberg, Nina F. E.","Department of Social and Organizational Psychology, VU University Amsterdam, The Netherlands",Hogrefe Publishing Group,JOUR
10.1001/jamaoncol.2018.2619,"Young-Afat, Danny A.","Department of Plastic, Reconstructive, and Hand Surgery, VU University Medical Centre, Amsterdam, the Netherlands.; Julius Center for Primary Health Sciences and Primary Care, Department of Clinical Epidemiology, University Medical Center, Utrecht, the Netherlands.",American Medical Association (AMA),JOUR
10.1155/2017/7454376,"van Ballegooijen, Adriana J.","Department of Health Sciences, Vrije Universiteit Amsterdam and the Amsterdam Public Health Research Institute, Amsterdam, Netherlands",Hindawi Limited,JOUR
10.1177/1477370815597251,"Rodermond, Elanie","VU University Amsterdam, The Netherlands; Netherlands Institute for the Study of Crime and Law Enforcement, The Netherlands",SAGE Publications,JOUR
10.1177/1350506817719393,"Davis, Kathy","VU University Amsterdam, the Netherlands",SAGE Publications,JOUR
10.1177/2053019613516289,"Biermann, Frank","VU University, The Netherlands; Lund University, Sweden",SAGE Publications,JOUR
10.1001/jamaneurol.2019.1534,"Bridel, Claire","Neurochemistry Laboratory, Department of Clinical Chemistry, VU University Medical Centre, Neuroscience Campus Amsterdam, Amsterdam, the Netherlands",American Medical Association (AMA),JOUR
10.1002/gsj.1092,"Erkelens, Rose","Department of Economics and Business Administration: Knowledge, Information, and Networks Research Group; VU University Amsterdam; The Netherlands",Wiley,JOUR
10.1002/ab.21655,"Bushman, Brad J.",School of Communication and Department of Psychology; The Ohio State University; Columbus Ohio; Department of Communication Science; VU University Amsterdam; The Netherlands,Wiley,JOUR
10.1890/09-2224.1,"van Geffen, Koert G.","Department of Systems Ecology, Institute of Ecological Sciences, VU University Amsterdam, De Boelelaan 1085, 1081 HV Amsterdam, The Netherlands; Instituto Boliviano de Investigación Forestal, Km 8½ Carratera al Norte, Facultad de Ciencias Agricolas, El Vallecito, Universidad Autonomia Gabriel Rene Moreno, Santa Cruz, Bolivia",Wiley,JOUR
10.1111/bor.12070,"Vandenberghe, Jef",Department of Earth Sciences; VU University; De Boelelaan 1085 1081 HV Amsterdam The Netherlands,Wiley,JOUR
10.1002/ppp.1847,"Vandenberghe, J.",Institute of Earth Sciences; VU University; Amsterdam The Netherlands,Wiley,JOUR
10.1002/ppp.1787,"Kitover, D. C.",Department of Earth Sciences; VU Universiteit Amsterdam; Amsterdam The Netherlands,Wiley,JOUR
10.1111/1365-2435.12127,"Soudzilovskaia, Nadejda A.","Systems Ecology Department; Faculty of Earth and Life Sciences; VU University Amsterdam; De Boelelaan 1085, 1081 HV Amsterdam The Netherlands",Wiley,JOUR
10.1111/j.1365-2486.2012.02663.x,"Keuper, Frida",Systems Ecology; Department of Ecological Science; VU University Amsterdam; De Boelelaan 1085; NL-1081 HV; Amsterdam; The Netherlands,Wiley,JOUR
10.1021/ac202878q,"Kimmel, Danielle W.","Department of Chemistry, Vanderbilt University, 7330 Stevenson Center, VU Station B 351822, Nashville, Tennessee 37235-1822, United States",American Chemical Society (ACS),JOUR
10.1002/acn3.50960,"Mendes, Marisa I.",Metabolic Unit Department of Clinical Chemistry Amsterdam Neuroscience Amsterdam Gastroenterology &amp; Metabolism Amsterdam UMC Vrije Universiteit Amsterdam Amsterdam Netherlands,Wiley,JOUR
10.1093/bioinformatics/btz917,"Jacobsen, Annika","Department of Computer Science, Centre for Integrative Bioinformatics (IBIVU), Vrije Universiteit Amsterdam, 1081 HV Amsterdam, Netherlands",Oxford University Press (OUP),JOUR
10.1063/1.5130206,"Heays, A. N.","Department of Physics and Astronomy, and LaserLaB, VU University, De Boelelaan 1081, 1081 HV Amsterdam, The Netherlands; Leiden Observatory, Leiden University, P.O. Box 9513, 2300 RA Leiden, The Netherlands; School of Earth and Space Exploration, Arizona State University, Tempe, Arizona 85287, USA; NASA Astrobiology Institute, NASA Ames Research Center, Moffett Field, California 94035, USA",AIP Publishing,JOUR
10.1177/1350506819892659,"Davis, Kathy","Sociology Department, VU University, The Netherlands",SAGE Publications,JOUR
10.1027/1016-9040/a000381,"van Prooijen, Jan-Willem","Department of Experimental and Applied Psychology, VU 					Amsterdam/The NSCR, Amsterdam, The Netherlands",Hogrefe Publishing Group,JOUR
10.1002/sd.2026,"Cummings, Sarah","Athena InstituteVU University Amsterdam Amsterdam The Netherlands; Knowledge, Technology and InnovationWageningen University &amp; Research Wageningen The Netherlands",Wiley,JOUR
10.1039/c9sc04705k,"Wallraven, Kerstin",Department of Chemistry & Pharmaceutical Sciences; VU University Amsterdam; 1081 HV Amsterdam; The Netherlands,Royal Society of Chemistry (RSC),JOUR
10.1111/acps.13155,"Nagel, Mats",Department of Clinical Genetics Section Complex Trait Genetics Amsterdam Neuroscience VU Medical Centre Amsterdam The Netherlands,Wiley,JOUR
10.1002/2211-5463.12792,"Sun, Wei",The Affiliated Stomatology Hospital Zhejiang University School of Medicine Hangzhou Zhejiang Province P.R. China; Key Laboratory of Oral Biomedical Research of Zhejiang Province Hangzhou Zhejiang Province P.R. China; Department of Oral Biochemistry Academic Centre for Dentistry Amsterdam (ACTA) University of Amsterdam (UvA) Vrije Universiteit Amsterdam (VU) Amsterdam the Netherlands,Wiley,JOUR
10.1080/20008198.2019.1705599,"Dimitrova, Lora","Department of Psychosis Studies, Institute of Psychiatry, King’s College London, London, UK; Department of Psychiatry, Amsterdam UMC, location VUMC, VU University Amsterdam, Amsterdam, the Netherlands",Informa UK Limited,JOUR
10.1039/c9an02087j,"Lochocki, Benjamin",Department of Physics and Astronomy; LaserLaB Amsterdam; VU Amsterdam; The Netherlands,Royal Society of Chemistry (RSC),JOUR
10.1111/cdev.13351,"Sierksma, Jellie",VU Amsterdam; University of Wisconsin–Madison,Wiley,JOUR
10.1111/jiec.12987,"Morseletto, Piero","Institute for Environmental Studies (IVM), Faculty of Earth and Life SciencesVU University Amsterdam Amsterdam The Netherlands; Business SchoolUniversity of Exeter Exeter UK",Wiley,JOUR
10.5281/zenodo.3640162,"Bosch, Sander",VU Amsterdam,Zenodo,GEN
10.5281/zenodo.3640163,"Bosch, Sander",VU Amsterdam,Zenodo,GEN
10.1177/2380084420902464,"Baâdoudi, F.","Department of Social Dentistry, Academic Centre for Dentistry Amsterdam, University of Amsterdam and VU University, Amsterdam, the Netherlands",SAGE Publications,JOUR
10.1080/09638288.2019.1693643,"Louwerse, Ilse","Department of Public and Occupational Health, Amsterdam Public Health Research Institute, Amsterdam UMC, Vrije Universiteit Amsterdam, Amsterdam, The Netherlands;; Dutch Institute of Employee Benefit Schemes (UWV), Amsterdam, The Netherlands;; Research Center for Insurance Medicine, AMC-UMCG-VUmc-UWV, Amsterdam, The Netherlands",Informa UK Limited,JOUR
10.1002/ejp.1488,"Mutubuki, Elizabeth N.",Department of Health Sciences Faculty of Science Vrije University AmsterdamAmsterdam Movement Sciences Research Institute Amsterdam The Netherlands,Wiley,JOUR
10.24433/co.8484557.v1,"Versluis, Laurens",VU University Amsterdam,Code Ocean,COMP
10.14768/06337394-73a9-407c-9997-0e380dac5595,"Luyssaert, Sebastiaan",VU Amsterdam,Institut Pierre-Simon Laplace,COMP
10.1075/celcr.22.05pas,"Pasma, Tryntje","formerly affiliated with VU University Amsterdam, The Netherlands",John Benjamins Publishing Company,CHAP
10.5281/zenodo.3604117,"Brummer, G.-J.A.",NIOZ & VU Amsterdam,Zenodo,DATA
10.5281/zenodo.3604118,"Brummer, G.-J.A.",NIOZ & VU Amsterdam,Zenodo,DATA
10.1111/imre.12138,"Ozgen, Ceren",VU University Amsterdam,SAGE Publications,JOUR
10.1002/jcsm.12521,"Yeung, Suey S.Y.","Department of Human Movement Sciences, @AgeAmsterdam, Faculty of Behavioural and Movement Sciences, Amsterdam Movement SciencesVrije Universiteit Amsterdam The Netherlands; Department of Medicine and Aged Care, @AgeMelbourne, The Royal Melbourne HospitalThe University of Melbourne City Campus, Level 6 North, 300 Grattan Street Parkville Victoria 3050 Australia",Wiley,JOUR
10.1002/prot.20957,"Sammeth, Michael","Centre for Integrative Bioinformatics (IBIVU), Vrije Universiteit, Amsterdam, The Netherlands",Wiley,JOUR
10.1002/9781119300762.wsts0132,"Hummel, Christiaan",Royal Netherlands Institute for Sea Research and Utrecht University; Yerseke The Netherlands; VU University; Amsterdam The Netherlands,"John Wiley & Sons, Inc.",JOUR
10.1111/risa.13361,"Robinson, Peter John","Department of Environmental Economics, Institute for Environmental StudiesVU University Amsterdam De Boelelaan Amsterdam The Netherlands",Wiley,JOUR
10.1111/jeb.12876,"Halfwerk, W.",Behavioural Biology; Institute of Biology (IBL); Leiden University; Leiden the Netherlands; Animal Ecology; Department of Ecological Science; VU University Amsterdam; Amsterdam the Netherlands,Wiley,JOUR
10.5061/dryad.1bm8c,"Voudouris, Dimitris",VU University Amsterdam,Dryad,DATA
10.5061/dryad.kk504,"Derkzen, Marthe L.",VU University Amsterdam,Dryad,DATA
10.5061/dryad.sm925,"Van Der Kooij, Katinka",VU University Amsterdam,Dryad,DATA
10.5061/dryad.9gc00,"Suring, Wouter",VU University Amsterdam,Dryad,DATA
10.5061/dryad.08c2k,"Werner, Gijsbert D. A.",VU University Amsterdam,Dryad,DATA
10.5061/dryad.m112v,"Huibers, Marcus J. H.",VU University Amsterdam; University of Pennsylvania,Dryad,DATA
10.5061/dryad.2j4qs89,"Liefting, Maartje",VU University Amsterdam; Freie Universität Berlin,Dryad,DATA
10.5061/dryad.n6k49,"Zuo, Juan",VU University Amsterdam,Dryad,DATA
10.5061/dryad.2kj8p,"Werner, Gijsbert D. A.",VU University Amsterdam; University of Oxford,Dryad,DATA
10.5061/dryad.56cn8015,"Verbruggen, Erik",VU University Amsterdam,Dryad,DATA
10.5061/dryad.m6dn0g8,"Ellers, Jacintha",VU University Amsterdam,Dryad,DATA
10.5061/dryad.6j9v0,"Engelmoer, Daniel J. P.",VU University Amsterdam,Dryad,DATA
10.5061/dryad.83dv5j7,"Goriounova, Natalia A",VU University Amsterdam,Dryad,DATA
10.5061/dryad.dg124q0,"Chen, Cong",Nederlands Instituut voor Ecologie; VU University Amsterdam,Dryad,DATA
10.5061/dryad.q09g2,"Fujii, Saori",Kyoto University; VU University Amsterdam; Yokohama National University,Dryad,DATA
10.5061/dryad.g3m1g92,"Blauw, Luke G.",VU University Amsterdam,Dryad,DATA
10.5061/dryad.6r6pn,"Krab, Eveline J.",VU University Amsterdam; Umeå University,Dryad,DATA
10.5061/dryad.t39g3,"Van Egmond, Emily M.",VU University Amsterdam,Dryad,DATA
10.5061/dryad.3723p,"Testa-Silva, Guilherme",VU University Amsterdam; Erasmus University Medical Center; Netherlands Institute for Neuroscience,Dryad,DATA
10.1080/17421772.2019.1623419,"Lankhuizen, Maureen","Department of Spatial Economics, VU University Amsterdam, Amsterdam, the Netherlands; and PBL Netherlands Environmental Assessment Agency, The Hague, the Netherlands.",Informa UK Limited,JOUR
10.1142/s0218194000000262,"MENZIES, TIM","NASA/WVU Software Research Lab, 100 University Drive, Fairmont, WV 26554, USA",World Scientific Pub Co Pte Lt,JOUR
10.1002/ccr3.2227,"Weide, Guido","Laboratory for Myology, Department of Human Movement Sciences, Amsterdam Movement Sciences Vrije Universiteit Amsterdam Amsterdam The Netherlands; Department of Rehabilitation Medicine, Amsterdam Movement Sciences Amsterdam UMC, location VUmc Amsterdam The Netherlands",Wiley,JOUR
10.1162/rest_a_00762,"König, Michael D.","CEPR, Swiss Economics Institute, and VU Amsterdam",MIT Press - Journals,JOUR
10.1002/jae.2319,"Jungbacker, Borus",Department of Econometrics; VU University Amsterdam; Netherlands,Wiley,JOUR
10.1002/dmrr.2247,"Peters, E. J. G.",Department of Internal Medicine; VU University Medical Centre; Amsterdam; The Netherlands,Wiley,JOUR
10.1142/s2010194515600228,"Buffing, M. G. A.","Theory Group, Nikhef &amp; Department of Physics, Faculty of Science, VU University, De Boelelaan 1081, NL-1081 HV Amsterdam, The Netherlands",World Scientific Pub Co Pte Lt,JOUR
10.1142/s0217751x10049505,"DE MAN, S.","Department of Physics, VU University Amsterdam, Amsterdam, 1081HV, The Netherlands",World Scientific Pub Co Pte Lt,JOUR
10.1142/s201000781750004x,"KAHSAY, TEWODROS NEGASH","Department of Environmental Economics, Institute for Environmental Studies, VU University Amsterdam, De Boelelaan 1087, 1081 HV, Amsterdam, The Netherlands; UNESCO-IHE, Delft, The Netherlands",World Scientific Pub Co Pte Lt,JOUR
10.1142/s2010194515600319,"Pisano, Cristian","Nikhef, The Netherlands; Department of Physics and Astronomy, VU University Amsterdam, De Boelelaan 1081, NL-1081 HV Amsterdam, The Netherlands",World Scientific Pub Co Pte Lt,JOUR
10.14768/06337394-73a9-407c-9997-0e380dac5596,"Luyssaert, Sebastiaan",VU Amsterdam,Institut Pierre-Simon Laplace,COMP
10.5281/zenodo.3468500,"Mahaki, Mohammadreza",VU Amsterdam,Zenodo,DATA
10.5281/zenodo.3468501,"Mahaki, Mohammadreza",VU Amsterdam,Zenodo,DATA
10.15139/s3/0yxg2j,"Righetti, Francesca",(VU Amsterdam),UNC Dataverse,DATA
10.15139/s3/fkgdkb,"Righetti, Francesca",(VU Amsterdam),UNC Dataverse,DATA
10.7910/dvn/z7p7rl,"Artiga Gonzalez, Tanja",(VU University Amsterdam),Harvard Dataverse,DATA
10.7910/dvn/z7p7rl/ekeqfi,"Artiga Gonzalez, Tanja",(VU University Amsterdam),Harvard Dataverse,DATA
10.7910/dvn/z7p7rl/uexqs8,"Artiga Gonzalez, Tanja",(VU University Amsterdam),Harvard Dataverse,DATA
10.7910/dvn/z7p7rl/dsrtwp,"Artiga Gonzalez, Tanja",(VU University Amsterdam),Harvard Dataverse,DATA
10.7910/dvn/z7p7rl/uvkama,"Artiga Gonzalez, Tanja",(VU University Amsterdam),Harvard Dataverse,DATA
10.7910/dvn/z7p7rl/rhkfjm,"Artiga Gonzalez, Tanja",(VU University Amsterdam),Harvard Dataverse,DATA
10.7910/dvn/z7p7rl/qjzc3b,"Artiga Gonzalez, Tanja",(VU University Amsterdam),Harvard Dataverse,DATA
10.7910/dvn/z7p7rl/alnb2x,"Artiga Gonzalez, Tanja",(VU University Amsterdam),Harvard Dataverse,DATA
10.7910/dvn/z7p7rl/m9tyxk,"Artiga Gonzalez, Tanja",(VU University Amsterdam),Harvard Dataverse,DATA
