doi,name,affiliation,publisher,type
10.1080/20008198.2019.1639312,"Rensen, Niki","Pediatric Oncology-Hematology, Cancer Center Amsterdam, Amsterdam UMC, Emma Children’s Hospital, Vrije Universiteit Amsterdam, Amsterdam, Netherlands; Princess Máxima Center for Pediatric Oncology, Utrecht, Netherlands",Informa UK Limited,JOUR
10.1093/bioinformatics/btz572,"Dijkstra, Maurits J J","Department of Computer Science, Vrije Universiteit, 1081 HV Amsterdam, The Netherlands",Oxford University Press (OUP),JOUR
10.1113/jp277985,"Najafi, Aref","Amsterdam UMC, Vrije Universiteit Amsterdam, PhysiologyAmsterdam Cardiovascular Sciences de Boelelaan 1117 1081 HZ Amsterdam the Netherlands; Netherlands Heart Institute PO box 19258 3501 DG Utrecht the Netherlands",Wiley,JOUR
10.1111/idh.12416,"Van Gils, Laura M.","Department of Periodontology, Academic Centre for Dentistry Amsterdam (ACTA) University of Amsterdam and Vrije Universiteit Amsterdam The Netherlands",Wiley,JOUR
10.1002/ange.201905838,"Collet, Jurriën W.","Department of Chemistry and Pharmaceutical Sciences and Amsterdam Institute for Molecules, Medicines &amp; Systems (AIMMS)Vrije Universiteit Amsterdam De Boelelaan 1108 1081 HZ Amsterdam The Netherlands; Organic SynthesisDepartment of ChemistryUniversity of Antwerp Groenenborgerlaan 171 2020 Antwerp Belgium",Wiley,JOUR
10.1002/anie.201905838,"Collet, Jurriën W.","Department of Chemistry and Pharmaceutical Sciences and Amsterdam Institute for Molecules, Medicines & Systems (AIMMS); Vrije Universiteit Amsterdam; De Boelelaan 1108 1081 HZ Amsterdam The Netherlands; Organic Synthesis; Department of Chemistry; University of Antwerp; Groenenborgerlaan 171 2020 Antwerp Belgium",Wiley,JOUR
10.1080/09297049.2019.1639652,"Twilhaar, E. Sabrina","Clinical Neuropsychology Section, Vrije Universiteit Amsterdam, Amsterdam, The Netherlands",Informa UK Limited,JOUR
10.1111/emip.12283,"Boevé, Anja J.",University of Groningen; Vrije Universiteit Amsterdam,Wiley,JOUR
10.1152/jn.00123.2019,"Smeets, Jeroen B. J.","Department of Human Movement Sciences, Vrije Universiteit Amsterdam, Amsterdam, The Netherlands",American Physiological Society,JOUR
10.1080/1057610x.2018.1543144,"Stephens, William","Vrije Universiteit Amsterdam, Amsterdam, The Netherlands",Informa UK Limited,JOUR
10.1111/joes.12332,"Robinson, Peter John",Vrije Universiteit Amsterdam Instituut voor Milieuvraagstukken,Wiley,JOUR
10.1002/1878-0261.12550,"Helden, Erik J.",Department of Medical Oncology Cancer Center Amsterdam Amsterdam UMC Vrije Universiteit Amsterdam The Netherlands,Wiley,JOUR
10.1002/da.22949,"Difrancesco, Sonia","Amsterdam UMC, Vrije Universiteit, PsychiatryAmsterdam Public Health Research Institute Amsterdam The Netherlands",Wiley,JOUR
10.1002/chem.201983861,"Saya, Jordy M.","Department of Chemistry &amp; Pharmaceutical Sciences, Amsterdam Institute for Molecules, Medicines &amp; SystemsVrije Universiteit Amsterdam De Boelelaan 1108 1081 HZ Amsterdam The Netherlands",Wiley,JOUR
10.1177/0093650219836059,"Kleinnijenhuis, Jan","Vrije Universiteit Amsterdam, The Netherlands",SAGE Publications,JOUR
10.1080/16549716.2019.1610253,"Meiqari, Lana","Athena Institute for Research on Innovation and Communication in Health and Life Sciences, Faculty of Sciences, Vrije Universiteit Amsterdam, Amsterdam, The Netherlands; Department of Public Health, Institute of Tropical Medicine, Antwerp, Belgium",Informa UK Limited,JOUR
10.1177/2050313x19849828,"Witteveen, M Emma","Department of Pathology, Amsterdam UMC, Vrije Universiteit Amsterdam, Amsterdam, The Netherlands",SAGE Publications,JOUR
10.1111/idh.12402,"Swaaij, Bregje W. M.","Department of Dental Hygiene, Hogeschool Arnhem Nijmegen University of Applied Sciences Nijmegen The Netherlands; Department of Periodontology, Academic Centre for Dentistry Amsterdam (ACTA) University of Amsterdam, Vrije Universiteit Amsterdam Amsterdam The Netherlands",Wiley,JOUR
10.1029/2019jb017488,"Flórez‐Rodríguez, A. G.",Department of Earth SciencesVrije Universiteit Amsterdam Amsterdam Netherlands; Department of GeologyUniversity of Oviedo Oviedo Spain,American Geophysical Union (AGU),JOUR
10.1111/idh.12401,"Elkerbout, Therese A.","Department of Periodontology, Academic Centre for Dentistry Amsterdam (ACTA) University of Amsterdam and Vrije Universiteit Amsterdam Amsterdam The Netherlands",Wiley,JOUR
10.1111/ecc.13095,"Kampshoff, Caroline S.","Department of Medical Oncology, Cancer Center Amsterdam (CCA)Amsterdam UMC, Vrije Universiteit Amsterdam Amsterdam The Netherlands",Wiley,JOUR
10.1093/jmcb/mjz046,"Lozano-Vidal, Noelia","Department of Physiology, Amsterdam Cardiovascular Sciences, Amsterdam Universitair Medische Centra, Vrije Universiteit Amsterdam, 1081 HZ, Amsterdam, the Netherlands",Oxford University Press (OUP),JOUR
10.1002/mgg3.632,"Cooiman, Mellody I.",Department of Bariatric Surgery Rijnstate Hospital/Vitalys Clinic Arnhem The Netherlands; Department of Clinical Genetics Amsterdam UMC Vrije Universiteit Amsterdam Amsterdam The Netherlands,Wiley,JOUR
10.1111/apt.15280,"Simsek, Melek","Department of Gastroenterology and Hepatology; Amsterdam UMC, Vrije Universiteit Amsterdam, AG&M Research Institute; Amsterdam The Netherlands",Wiley,JOUR
10.1002/cmdc.201900538,"Sijm, Maarten","Division of Medicinal Chemistry, Faculty of Sciences, Amsterdam Institute for Molecules, Medicines and Systems (AIMMS)Vrije Universiteit Amsterdam De Boelelaan 1108 1081 HZ Amsterdam The Netherlands",Wiley,JOUR
10.1002/chem.201905359,"Sergeieva, Tetiana",Institute for Organic ChemistryUniversity of Freiburg Albertstrasse 21 79104 Freiburg im Breisgau Germany; Department of Theoretical ChemistryAmsterdam Center for Multiscale Modeling (ACMM)Vrije Universiteit Amsterdam De Boelelaan 1083 1081 HV Amsterdam The Netherlands,Wiley,JOUR
10.1021/acs.jpcc.9b09366,"Petelski, Andre N.","Department of Theoretical Chemistry and Amsterdam Center for Multiscale Modeling, Vrije Universiteit Amsterdam, De Boelelaan 1083, 1081HV Amsterdam, The Netherlands; Departamento de Ingeniería Química, Grupo de Investigación en Química Teórica y Experimental (QuiTEx), Facultad Regional Resistencia, Universidad Tecnológica Nacional, French 414 (H3500CHJ), Resistencia, Chaco, Argentina",American Chemical Society (ACS),JOUR
10.1111/pce.13687,"Janssen, Thomas A. J.","Department of Earth Sciences, Cluster Earth and ClimateVrije Universiteit Amsterdam Amsterdam The Netherlands",Wiley,JOUR
10.1590/1806-9126-rbef-2019-0033,"de Ronde, Christian","Vrije Universiteit,  Belgium; Universidad de Buenos Aires,  Argentina; Universidad Nacional Arturo Jauretche,  Argentina",FapUNIFESP (SciELO),JOUR
10.1111/clr.13558,"Teng, Fei",The Affiliated Stomatology Hospital Zhejiang University School of Medicine Hangzhou China; Key Laboratory of Oral Biomedical Research of Zhejiang Province Hangzhou China; Department of Oral Implantology and Prosthetic Dentistry Academic Centre for Dentistry Amsterdam (ACTA) University of Amsterdam and Vrije Universiteit Amsterdam The Netherlands,Wiley,JOUR
10.1111/gcb.14940,"Prestele, Reinhard",Environmental Geography Group Institute for Environmental Studies (IVM) Vrije Universiteit Amsterdam Amsterdam The Netherlands,Wiley,JOUR
10.1002/chem.201901130,"Saya, Jordy M.","Department of Chemistry &amp; Pharmaceutical Sciences, Amsterdam Institute for Molecules, Medicines &amp; SystemsVrije Universiteit Amsterdam De Boelelaan 1108 1081 HZ Amsterdam The Netherlands",Wiley,JOUR
10.1080/00224545.2019.1610348,"De Waal-Andrews, Wendy",Vrije Universiteit Amsterdam,Informa UK Limited,JOUR
10.1002/etc.4634,"Lima e Silva, Cláudia",Vrije Universiteit Amsterdam The Netherlands,Wiley,JOUR
10.1080/10439463.2019.1606808,"Eski, Yarin","Knowledge Hub Security and Social Resilience, Department of Political Science and Public Administration, Vrije Universiteit Amsterdam, Amsterdam, Netherlands",Informa UK Limited,JOUR
10.1002/jqs.3157,"Li, Huan","Vrije Universiteit Amsterdam, Faculty of Sciences, Cluster Earth and Climate, De Boelelaan 1085 Amsterdam The Netherlands",Wiley,JOUR
10.1002/anie.201903196,"Hamlin, Trevor A.",Department of Theoretical Chemistry; Amsterdam Center for Multiscale Modeling (ACMM); Vrije Universiteit Amsterdam; De Boelelaan 1083 1081 HV Amsterdam The Netherlands,Wiley,JOUR
10.1111/biom.13059,"Dobler, Dennis",Department of MathematicsVrije Universiteit Amsterdam Amsterdam Netherlands,Wiley,JOUR
10.1080/26410397.2019.1601964,"Graamans, Ernst Patrick","Researcher, School of Business and Economics, Change Management, Vrije Universiteit, Amsterdam, The Netherlands.",Informa UK Limited,JOUR
10.1002/ange.201903196,"Hamlin, Trevor A.",Department of Theoretical ChemistryAmsterdam Center for Multiscale Modeling (ACMM)Vrije Universiteit Amsterdam De Boelelaan 1083 1081 HV Amsterdam Niederlande,Wiley,JOUR
10.1152/ajpendo.00142.2019,"Beekman, Kerensa M.","Section of Endocrinology, Department of Internal Medicine, Amsterdam UMC, Vrije Universiteit Amsterdam, Amsterdam Movement Sciences, Amsterdam, The Netherlands; Department of Radiology and Nuclear Medicine, Amsterdam UMC, University of Amsterdam, Amsterdam Movement Sciences, Amsterdam, The Netherlands",American Physiological Society,JOUR
10.1111/hex.12951,"Vat, Lidewij Eva",Athena Institute Vrije Universiteit Amsterdam Amsterdam The Netherlands,Wiley,JOUR
10.1080/17539153.2019.1658415,"Stephens, William","Department of Political Science and Public Administration, Vrije Universiteit Amsterdam, Amsterdam, The Netherlands",Informa UK Limited,JOUR
10.1111/joor.12886,"Selms, Maurits K. A.",Department of Orofacial Pain and Dysfunction Academic Centre for Dentistry Amsterdam (ACTA) University of Amsterdam and Vrije Universiteit Amsterdam Amsterdam The Netherlands,Wiley,JOUR
10.1111/iej.13218,"Baaij, A.",Department of Endodontology Academic Centre for Dentistry Amsterdam (ACTA) University of Amsterdam and Vrije Universiteit Amsterdam Amsterdam The Netherlands,Wiley,JOUR
10.1080/13803610701640235,"Korthagen, Fred A. J.","a  Vrije Universiteit Amsterdam ,  The Netherlands",Informa UK Limited,JOUR
10.1002/ejsp.2331,"van Prooijen, Jan-Willem",Vrije Universiteit Amsterdam; The Netherlands; The NSCR; The Netherlands,Wiley,JOUR
10.1111/jsr.12802,"Hulsegge, Gerben",Department of Public and Occupational Health; Amsterdam UMC; Vrije Universiteit Amsterdam; Amsterdam Public Health Research Institute; Amsterdam The Netherlands,Wiley,JOUR
10.1108/cdi-08-2017-0143,"Akkermans, Jos","Department of Management and Organization, Vrije Universiteit Amsterdam, Amsterdam, The Netherlands",Emerald,JOUR
10.1163/15718107-08601004,"Spijkerboer, Thomas",Vrije Universiteit AmsterdamNetherlands,Brill,JOUR
10.1146/annurev-biochem-013118-111902,"Pegtel, D. Michiel","Amsterdam UMC, Vrije Universiteit Amsterdam, Department of Pathology, Cancer Center Amsterdam, 1081 HV Amsterdam, The Netherlands;",Annual Reviews,JOUR
10.1080/01639625.2017.1411030,"Weulen Kranenbarg, Marleen","Department of Criminology, Faculty of Law, Vrije Universiteit, Amsterdam, The Netherlands",Informa UK Limited,JOUR
10.1001/jamapediatrics.2017.5323,"Twilhaar, E. Sabrina","Clinical Neuropsychology Section, Vrije Universiteit Amsterdam, Amsterdam, the Netherlands",American Medical Association (AMA),JOUR
10.1089/g4h.2017.0038,"Aarnoudse-Moens, Cornelieke S.H.","Department of Pediatrics, Emma Children's Hospital, Academic Medical Centre, Amsterdam, The Netherlands.; Clinical Neuropsychology Section, Department of Behavioral and Movement Sciences, Vrije Universiteit Amsterdam, Amsterdam, The Netherlands.",Mary Ann Liebert Inc,JOUR
10.1080/001401399185054,"KUIJER, P. PAUL F. M.","a  ERGOcare, Faculty of Human Movement Sciences, Faculty of Medicine, Vrije Universiteit Amsterdam, Van der Boechorststraat 9, 1081 BT Amsterdam, The Netherlands",Informa UK Limited,JOUR
10.1057/palgrave.jit.2000053,"Huysman, Marleen","Vrije Universiteit Amsterdam, Amsterdam, The Netherlands;",SAGE Publications,JOUR
10.1146/annurev-clinpsy-050718-095424,"Cuijpers, Pim","Department of Clinical, Neuro-, and Developmental Psychology, Amsterdam Public Health Research Institute, Vrije Universiteit Amsterdam, 1081 BT Amsterdam, The Netherlands;",Annual Reviews,JOUR
10.1152/physrev.00040.2017,"van der Velden, Jolanda","Amsterdam UMC, Vrije Universiteit Amsterdam, Physiology, Amsterdam Cardiovascular Sciences, Amsterdam, The Netherlands; and Department of Physiology, Kilimanjaro Christian Medical University College, Moshi, Tanzania",American Physiological Society,JOUR
10.1177/1354066107076955,"Van Kersbergen, Kees","Vrije Universiteit, The Netherlands and Radboud University, The Netherlands",SAGE Publications,JOUR
10.1021/acs.jcim.9b00384,"Zapata, Felipe","Division of Theoretical Chemistry, Faculty of Science, Vrije Universiteit Amsterdam, de Boelelaan 1083, 1081 HV Amsterdam, The Netherlands; Netherlands eScience Center, Science Park 140 (Matrix I), 1098 XG Amsterdam, The Netherlands",American Chemical Society (ACS),JOUR
10.1002/cyto.a.23725,"Dusoswa, Sophie A.","Amsterdam UMC, Vrije Universiteit Amsterdam, Department of Molecular Cell Biology &amp; ImmunologyAmsterdam Infection &amp; Immunity Institute and Cancer Center Amsterdam Amsterdam The Netherlands",Wiley,JOUR
10.1002/pon.5316,"Setyowibowo, Hari","Department of Clinical, Neuro‐ and Developmental PsychologyVrije Universiteit Amsterdam Amsterdam The Netherlands; Department of Educational Psychology, Faculty of PsychologyUniversitas Padjadjaran Jatinangor Indonesia",Wiley,JOUR
10.1111/maps.13425,"Lin, Yanhao",Department of Earth Sciences Faculty of Science Vrije Universiteit Amsterdam De Boelelaan 1085 1081 HV Amsterdam the Netherlands,Wiley,JOUR
10.1021/acs.analchem.9b03670,"van Harskamp, Dewi","Amsterdam UMC, University of Amsterdam, Vrije Universiteit, Emma Children’s Hospital, Amsterdam, Meibergdreef 9, 1105AZ Amsterdam, The Netherlands",American Chemical Society (ACS),JOUR
10.1111/idh.12423,"Valkenburg, Cees",General Dentist and Clinical Epidemiologist Hoevelaken The Netherlands; Department of Periodontology Academic Centre for Dentistry Amsterdam (ACTA) University of Amsterdam and Vrije Universiteit Amsterdam Amsterdam The Netherlands,Wiley,JOUR
10.1111/apa.15095,"Veen, Sarit",Department of Neonatology Emma Children’s Hospital Amsterdam UMC University of Amsterdam Amsterdam The Netherlands; Department of Pediatrics Amsterdam Reproduction and Development Amsterdam UMC Emma Neuroscience Group at Emma Children’s Hospital University of Amsterdam &amp; Vrije Universiteit Amsterdam Amsterdam The Netherlands,Wiley,JOUR
10.1002/jcc.25871,"Sun, Xiaobo","Department of Theoretical Chemistry and Amsterdam Center for Multiscale ModelingVrije Universiteit Amsterdam De Boelelaan 1083, 1081 HV Amsterdam Netherlands",Wiley,JOUR
10.1021/acs.jctc.9b01133,"Gerolin, Augusto","Department of Theoretical Chemistry and Amsterdam Center for Multiscale Modeling, FEW, Vrije Universiteit, De Boelelaan 1083, 1081HV Amsterdam, The Netherlands",American Chemical Society (ACS),JOUR
10.1002/for.2585,"Borovkova, Svetlana",School of Business and EconomicsVrije Universiteit Amsterdam Amsterdam The Netherlands,Wiley,JOUR
10.1111/jep.13321,"Damman, Olga C.","Amsterdam UMC, Vrije Universiteit Amsterdam, Department of Public and Occupational HealthAmsterdam Public Health Research Institute Amsterdam The Netherlands",Wiley,JOUR
10.1080/17487870.2019.1630123,"Gradus, Raymond","School of Business and Economics, Department of Accounting, Vrije Universiteit Amsterdam, Amsterdam, The Netherlands",Informa UK Limited,JOUR
10.1021/acs.jpclett.9b00469,"Kooi, Derk P.","Department of Theoretical Chemistry and Amsterdam Center for Multiscale Modeling, Faculty of Science, Vrije Universiteit Amsterdam, 1081 HV Amsterdam, The Netherlands",American Chemical Society (ACS),JOUR
10.1080/17408989.2019.1688773,"Kok, Marjan","Department of Human Movement Sciences, Faculty of Behavioural and Movement Sciences, Vrije Universiteit, Amsterdam, The Netherlands",Informa UK Limited,JOUR
10.1093/joc/jqz038,"Kleinnijenhuis, Jan","Vrije Universiteit Amsterdam, Department of Communication Science",Oxford University Press (OUP),JOUR
10.1002/1878-0261.12617,"Kruger, Dinja T.",Department of Medical Oncology Amsterdam UMC Vrije Universiteit Amsterdam/Cancer Center Amsterdam The Netherlands,Wiley,JOUR
10.1002/pon.5323,"Holtmaat, Karen","Department of Clinical, Neuro‐ and Developmental Psychology, Amsterdam Public Health Research Institute (APH)Vrije Universiteit Amsterdam Amsterdam The Netherlands; Cancer Center Amsterdam (CCA)Amsterdam Public Health Research Institute (APH) Amsterdam The Netherlands",Wiley,JOUR
10.1177/2040620718822660,"Franssen, Laurens E.","Department of Hematology, Amsterdam UMC, Vrije Universiteit Amsterdam, Amsterdam, The Netherlands",SAGE Publications,JOUR
10.1002/chem.201905355,"Narsaria, Ayush K.","Department of Theoretical Chemistry and Amsterdam Center for, Multiscale Modeling (ACMM)Vrije Universiteit Amsterdam De Boelelaan 1083 1081 HV Amsterdam The Netherlands",Wiley,JOUR
10.1111/bdi.12825,"Markt, Afra",Psychiatry Amsterdam UMC Vrije Universiteit Amsterdam Amsterdam Public Health Research Institute Amsterdam The Netherlands; GGZ inGeest Specialized Mental Health Care Amsterdam The Netherlands,Wiley,JOUR
10.1080/14999013.2019.1577317,"de Ruigh, Esther L.","Department of Child and Adolescent Psychiatry, Amsterdam UMC, Vrije Universiteit Amsterdam, Amsterdam, The Netherlands;",Informa UK Limited,JOUR
10.1177/1477370819887513,"Eski, Yarin","Vrije Universiteit Amsterdam, The Netherlands",SAGE Publications,JOUR
10.1021/acsptsci.8b00051,"Arimont, Marta","Division of Medicinal Chemistry, Faculty of Sciences, Amsterdam Institute of Molecules, Medicines and Systems (AIMMS), Vrije Universiteit Amsterdam, De Boelelaan 1108, 1081 HZ Amsterdam, The Netherlands",American Chemical Society (ACS),JOUR
10.1093/hropen/hoz045,"Roest, Inez","Department of Reproductive Medicine, Máxima Medical Centre, Veldhoven, Eindhoven, the Netherlands; Department of Reproductive Medicine, Amsterdam University Medical Centre, Vrije Universiteit Amsterdam, Amsterdam, the Netherlands; Grow Research School Oncology and Developmental Biology, Maastricht University, Maastricht, the Netherlands",Oxford University Press (OUP),JOUR
10.1002/chem.201900867,"Hamlin, Trevor A.",Department of Theoretical ChemistryAmsterdam Center for Multiscale Modeling (ACMM)Vrije Universiteit Amsterdam De Boelelaan 1083 1081 HV Amsterdam The Netherlands,Wiley,JOUR
10.1177/0956797619837981,"Plaisier, Myrthe A.","Department of Human Movement Sciences, Vrije Universiteit Amsterdam",SAGE Publications,JOUR
10.1093/jbcr/irz166,"Legemate, Catherine M","Department of Plastic, Reconstructive and Hand Surgery, Amsterdam UMC, Vrije Universiteit Amsterdam, Amsterdam Movement Sciences, de Boelelaan 1117, Amsterdam, the Netherlands; Burn Center, Maasstad Hospital, AC Rotterdam, the Netherlands Rotterdam, the Netherlands",Oxford University Press (OUP),JOUR
10.1177/1178632919837632,"van Hout, Hein PJ","Department of General Practice and Elderly Care Medicine, Amsterdam UMC, Vrije Universiteit, Amsterdam Public Health, Amsterdam, The Netherlands",SAGE Publications,JOUR
10.1080/10720537.2019.1581999,"Grimell, Jan","Vrije Universiteit Amsterdam, Amsterdam, The Netherlands",Informa UK Limited,JOUR
10.1080/24748668.2019.1632581,"Ladru, Bo-Jane","Department of Human Movement Sciences, Vrije Universiteit Amsterdam, Amsterdam Movement Sciences, Amsterdam, the Netherlands; Kinetic Analysis, Jheronimus Academy of Data Science, 's-Hertogenbosh, The Netherlands",Informa UK Limited,JOUR
10.5281/zenodo.3665733,"Eilander, Dirk","Institute for Environmental Studies (IVM), Vrije Universiteit Amsterdam",Zenodo,DATA
10.5281/zenodo.3665734,"Eilander, Dirk","Institute for Environmental Studies (IVM), Vrije Universiteit Amsterdam",Zenodo,DATA
10.1080/14763141.2019.1650102,"Ganzevles, Sander P. M.","Department of Human Movement Sciences, Faculty of Behavioural and Movement Sciences, Vrije Universiteit Amsterdam, Amsterdam, The Netherlands",Informa UK Limited,JOUR
10.1093/erae/jbz039,"Zant, Wouter","Vrije Universiteit, Amsterdam, The Netherlands; Tinbergen Institute, Amsterdam, The Netherlands",Oxford University Press (OUP),JOUR
10.1021/acs.jcim.9b00609,"Rifai, Eko Aditya","AIMMS Division of Molecular and Computational Toxicology, Department of Chemistry and Pharmaceutical Sciences, Vrije Universiteit Amsterdam, De Boelelaan 1108, 1081 HZ Amsterdam, The Netherlands",American Chemical Society (ACS),JOUR
10.1093/ckj/sfz156,"de Roij van Zuijdewijn, Camiel L M","Department of Nephrology, Amsterdam Cardiovascular Sciences, Amsterdam UMC, Vrije Universiteit Amsterdam, Amsterdam, The Netherlands",Oxford University Press (OUP),JOUR
10.1002/jts5.47,"van Sintemaartensdijk, Iris","Department of Experimental and Applied Psychology; Vrije Universiteit Amsterdam; Amsterdam The Netherlands; Department of Conflict, Risk and Safety; Twente University; Enschede The Netherlands",Wiley,JOUR
10.1021/acs.jpclett.9b00437,"Liguori, Nicoletta","Department of Physics and Astronomy, Faculty of Sciences, Vrije Universiteit Amsterdam, De Boelelaan 1081, 1081 HV Amsterdam, The Netherlands",American Chemical Society (ACS),JOUR
10.1021/acsaem.9b00452,"Tulus, ","Physics of Energy, Department of Physics &amp; Astronomy, Faculty of Sciences, Vrije Universiteit Amsterdam, 1081 HV Amsterdam, The Netherlands; Laboratory of Technology for Polymer, Agency for the Assessment and Application of Technology (BPPT), Jakarta 10340, Indonesia",American Chemical Society (ACS),JOUR
10.1111/dme.14163,"Snoek, F. J.",Professor of Medical Psychology Amsterdam University Medical Centres Vrije Universiteit Amsterdam The Netherlands,Wiley,JOUR
10.1021/acs.molpharmaceut.9b00360,"De Groof, Timo W. M.","Division of Medicinal Chemistry, Amsterdam Institute for Molecules Medicines and Systems (AIMMS), Vrije Universiteit Amsterdam, De Boelelaan 1108, 1081 HZ Amsterdam, The Netherlands",American Chemical Society (ACS),JOUR
10.1093/cvr/cvz111,"Kuster, Diederik W D","Cell and Molecular Physiology, Loyola University Chicago, Maywood, IL, USA; Department of Physiology, Amsterdam UMC, Vrije Universiteit Amsterdam, Amsterdam Cardiovascular Sciences, Amsterdam, Netherlands",Oxford University Press (OUP),JOUR
10.7554/elife.49130,"Ort, Eduard","Department of Experimental and Applied Psychology, Vrije Universiteit Amsterdam, Amsterdam, Netherlands; Institute for Brain and Behavior Amsterdam, Amsterdam, Netherlands","eLife Sciences Publications, Ltd",JOUR
10.1080/10749039.2019.1690520,"Rezende da Cunha Júnior, Fernando",Vrije Universiteit Amsterdam,Informa UK Limited,JOUR
10.1080/14616734.2019.1589062,"Schuengel, Carlo","Section of Clinical Child and Family Studies, Faculty of Behavioural and Movement Sciences, Vrije Universiteit Amsterdam, Amsterdam Public Health research institute, Amsterdam, The Netherlands",Informa UK Limited,JOUR
10.1093/brain/awz143,"Preziosa, Paolo","Department of Anatomy and Neurosciences, Amsterdam Neuroscience, Amsterdam UMC, Vrije Universiteit Amsterdam, Amsterdam, The Netherlands; Neuroimaging Research Unit, Institute of Experimental Neurology, Division of Neuroscience, San Raffaele Scientific Institute, Vita-Salute San Raffaele University, Milan, Italy; Department of Neurology, Institute of Experimental Neurology, Division of Neuroscience, San Raffaele Scientific Institute, Vita-Salute San Raffaele University, Milan, Italy",Oxford University Press (OUP),JOUR
10.1111/opo.12642,"Elsman, Ellen B M",Department of Ophthalmology Amsterdam Public Health research Institute Amsterdam UMC Vrije Universiteit Amsterdam Amsterdam The Netherlands,Wiley,JOUR
10.1080/03075079.2019.1679764,"Orazbayeva, Balzhan","Science-to-Business Marketing Research Centre, Münster University of Applied Sciences, Münster, Germany; Science, Businesses and Innovation, Vrije Universiteit Amsterdam, Amsterdam, the Netherlands",Informa UK Limited,JOUR
10.1080/14992027.2019.1691746,"van Leeuwen, Lisette M.","Otolaryngology-Head and Neck Surgery, Ear and Hearing, Amsterdam Public Health research institute, Amsterdam UMC, Vrije Universiteit Amsterdam, Amsterdam, The Netherlands;",Informa UK Limited,JOUR
10.1093/hmg/ddz219,"Abdellaoui, Abdel","Department of Psychiatry, Amsterdam UMC, University of Amsterdam, Amsterdam, The Netherlands; Department of Biological Psychology, Vrije Universiteit, Amsterdam, The Netherlands",Oxford University Press (OUP),JOUR
10.1177/1542305019848436,"Grimell, Jan","Vrije Universiteit Amsterdam, The Netherlands",SAGE Publications,JOUR
10.1080/00219266.2019.1703785,"Geraedts, Caspar","LEARN! Academy, Faculty of Behavioural and Movement Sciences, Vrije Universiteit Amsterdam, Amsterdam, The Netherlands",Informa UK Limited,JOUR
10.1002/mpr.1762,"Cuijpers, Pim","Department of Clinical, Neuro and Developmental Psychology, Amsterdam Public Health Research InstituteVrije Universiteit Amsterdam Amsterdam The Netherlands",Wiley,JOUR
10.1002/jcc.25775,"Cesario, Diego","Department of Chemistry and Pharmaceutical Sciences, Amsterdam Center for Multiscale Modeling; Vrije Universiteit Amsterdam; 1081 HV, Amsterdam The Netherlands; Department of Chemistry, Biology and Biotechnology; University of Perugia; I-06123, Perugia Italy",Wiley,JOUR
10.1210/jc.2018-02065,"Walenkamp, Marie J E","Department of Pediatrics, Emma Children’s Hospital, Amsterdam UMC, Vrije Universiteit Amsterdam, Amsterdam, Netherlands",The Endocrine Society,JOUR
10.1287/trsc.2018.0863,"de Jong, Gerben","School of Business and Economics, Vrije Universiteit Amsterdam, 1081 HV Amsterdam, Netherlands;",Institute for Operations Research and the Management Sciences (INFORMS),JOUR
